,video_id,title,channel,published_at,views,likes,dislikes,comments
193,w_ZPVtHdLm8,India Pakistan Conflict: इस मिसाइल की ताकत से पाकिस्तान हैरान! Operation Sindoor | Modi | Rajneeti,Zee News,2025-05-12T16:24:19Z,22982,429,7,14
194,8OO9b6S0lh4,Operation Sindoor: जनाजे की तस्वीर का सच पता लग गया | MG | Pakistan Army - MG,LokmatHindi,2025-05-13T04:48:49Z,36170,153,3,19
195,B1crunZSJIE,అరగంటలో 5 టార్గెట్లుLIVE : Operation Sindoor Update | India Vs Pakistan War Updates |  Modi | BIG TV,BIG TV Live,2025-05-12T01:33:47Z,42526,239,0,4
196,K79YTie6ldM,India Pakistan Conflict: रफाल का पहला टेस्ट...पाकिस्तान पर! Operation Sindoor | PM Modi,Zee Bihar Jharkhand,2025-05-13T03:22:31Z,2004,18,0,0
197,qLYMKRau79E,LIVE: ದೇಶವನ್ನುದ್ದೇಶಿಸಿ ಪ್ರಧಾನಿ ಮೋದಿ ಭಾಷಣ | Operation Sindoor | India vs Pakistan | Suvarna News,Asianet Suvarna News,2025-05-12T18:14:29Z,178994,1367,7,8
198,FzGqedHgEhk,Why Pakistan Doesn't Respect Women? | India | Operation Sindoor | Suresh Kochattil | Nationalist Hub,Nationalist Hub,2025-05-13T02:30:18Z,13746,909,12,34
199,d2olF0Lub_c,Operation Sindoor Is Not Over—It’s the New Normal | PM Modi,MyGov India,2025-05-12T17:41:31Z,203982,10402,12,65
200,IWE-jsxQ8cw,Top News: IND-PAK से जुड़ी बड़ी खबर | Operation Sindoor | India Pak War Updates | Ceasefire,ABP NEWS,2025-05-13T06:47:06Z,11729,111,0,4
201,JPnP-2VExcc,"""ഓപ്പറേഷൻ സിന്ദൂർ അവസാനിച്ചിട്ടില്ല..."" | Narendra Modi | Operation Sindoor",Marunadan Malayali,2025-05-13T12:47:53Z,60454,1434,12,23
202,tAFN-_tt49I,പ്രധാനമന്ത്രി രാജ്യത്തെ അഭിസംബോധന ചെയ്യുന്നു |PM Modi's first address after Operation Sindoor,Mathrubhumi News,2025-05-12T15:24:23Z,186533,1187,13,155
203,P7QBKvv1qzo,PM Modi LIVE | PM Modi Address The Nation LIVE। Operation Sindoor के बाद PM का देश के नाम संबोधन!,TIMES NOW Navbharat,2025-05-13T01:35:41Z,277609,3365,110,4
204,-VpoRbS1idc,Ceasefire Update: Operation Sindoor पर बोले मोदी |PM Modi Speech | Nuclear Weapon India Pakistan War,Dainik Jagran - दैनिक जागरण,2025-05-12T15:48:01Z,61500,985,10,172
205,dvLAtH52KSg,Operation Sindoor is now India's policy against terrorism: PM Modi,Narendra Modi,2025-05-13T01:30:34Z,109283,9791,174,402
206,n-OLDJeY1UI,Hemant Atri on PM Modi’s Address to Nation on Operation Sindoor & Visit to Adampur Air Force Station,The Public India,2025-05-13T10:30:35Z,84306,3589,9,535
207,zqFGd2Y-vjI,"""सोफिया कुरैशी का मुसलमान होना सोशल मीडिया पर..."" | Operation Sindoor | India Pakistan War #shorts",News18 India,2025-05-13T13:47:37Z,193241,2133,27,53
208,LQOjhav5S6Q,Live: ପରମାଣୁ ଯୁଦ୍ଧ ଚାହୁଁଛି ପାକିସ୍ତାନ ! | India Pakistan War | Operation Sindoor 2 | Ceasefire,News18 Odia,2025-05-12T16:29:23Z,32516,271,4,0
209,br3KF1Wa2Pw,Operation Sindoor | India Pakistan War | Shahid Afridi Pakistan Army का कोरा झूठ | Pakistan Roast,Switch,2025-05-12T16:30:24Z,108815,3417,20,378
210,Zh4h5HcUlNo,Top Headlines Of The Day: Operation Sindoor | PM Modi | | Donald Trump | IPL | Amit Shah,Aaj Tak,2025-05-12T21:08:43Z,19255,115,0,5
211,nvGxzRUPhno,പാകിസ്താൻ്റെ നുണബോംബ് തകത്ത് ഇന്ത്യൻ സേന | Operation Sindoor | India Pakistan War |Drone Attack,News18 Kerala,2025-05-12T17:35:53Z,17103,226,1,20
212,OzaYr4CvPlg,OPERATION SINDOOR: Modi breaks his silence! | Update #4,meghnerd,2025-05-13T08:30:06Z,21597,1098,23,431
213,EfK8HREZF3w,🔴LIVE : Operation Sindoor India Pak War Live Updates : మసూద్ అజార్‌కు 14 కోట్లు సాయం || Masood Azhar,Sumantv Khammam,2025-05-14T00:20:22Z,566176,1978,15,0
214,ZSsiMuVFTYo,பாகிஸ்தானின் மையப் பகுதியை அழித்தொழித்த இந்தியா | Indian Army | Operation sindoor |,Shree TV,2025-05-13T15:01:02Z,44844,1541,3,26
215,_NnCCFlpo8Y,युद्ध आमुचे सुरुच | Sushil Kulkarni | Analyser | Operation Sindoor | India,Analyser News,2025-05-13T10:30:20Z,17827,1889,3,117
216,7V90DqegOqk,Operation Sindoor पर Air Marshal की मुस्कान और Pakistan के परमाणु ठिकाने के बीच क्या कनेक्शन?,The Lallantop,2025-05-12T11:30:09Z,527972,7019,82,644
217,DjINI-UUisM,PM Modi speech - “தாக்குதலை நிறுத்த கெஞ்சியது Pakistan” - Operation Sindoor | India vs பாகிஸ்தான்,Vikatan TV,2025-05-12T17:45:01Z,8758,190,0,41
218,Q6SOsoDHzl4,Operation sindoor: आतंक के खिलाफ 'लाउड एंड क्लियर' मैसेज | PM Modi in Adampur Airbase | India-Pak,ABP NEWS,2025-05-13T13:10:06Z,8804,90,0,14
219,L-govs2ApRY,"Operation Sindoor: जवानों के बीच से पीएम का संदेश, इधर आतंकी ढेर | ABP News | India-Pak Tension",ABP NEWS,2025-05-13T16:15:31Z,3529,24,0,1
220,Mh_BN8iGGis,PM Modi LIVE | ఆపరేషన్ సిందూర్ విజయం పై పీఎం మోదీ ప్రసంగం | Operation Sindoor - TV9,TV9 Telugu Live,2025-05-13T04:14:30Z,615213,4702,461,0
221,GbslrYhzCAY,How India Achieved Something Israel Couldn't? | Sai Krishna | Operation Sindoor | Nationalist Hub,Nationalist Hub,2025-05-13T12:01:14Z,21760,1509,22,114
222,AHew6c_D5H0,Operation Sindoor is an unwavering pledge to justice: PM Modi,Narendra Modi,2025-05-12T17:01:40Z,190168,13838,6,505
223,b4kzh_VqQuo,ମିଟିଂରେ ଭାରତର ୭ ବଡ଼ ସର୍ତ୍ତ | India Pakistan War | Operation Sindoor | DGMO Meeting | War Update,News18 Odia,2025-05-12T08:03:29Z,274457,1172,6,58
224,OLdu5Dpxflg,OPERATION SINDOOR   ട്രംപിനെ സൈഡാക്കി മോദി,Malayalivartha Inside,2025-05-13T03:55:31Z,42904,870,3,43
225,8I6UdB9EAFI,Shankhnaad: विपक्ष की पुकार..विशेष सत्र बुलाए सरकार | PM Modi | Operation Sindoor | AajTak News,Aaj Tak,2025-05-12T16:05:06Z,33796,217,0,88
226,GcdSZo50LrM,Operation Sindoor: जैश का मरकज सुभानअल्लाह: 600 आतंकियों का गढ़...Rafale ने ऐसे किया तबाह!,Prabhat Khabar,2025-05-13T13:06:36Z,25298,167,2,2
227,10CU_YM_UDI,Prof Dr GVR Sastry Reaction on PM MODI Decision on Operation Sindoor | Trump | Chaina | TV5 Murthy,TV5 News ,2025-05-13T16:20:09Z,24072,298,7,13
228,iii85J3vIUg,🔴LIVE :Operation Sindoor : India Pak War Live Updates : పాకిస్తాన్ లో పే_లిన అణుబాం_బు..?,Sumantv Khammam,2025-05-14T00:16:34Z,362878,1647,28,0
229,NYEVMBPcRPQ,India Pakistan Ceasefire Violation: भारत पाकिस्तान का युद्ध शुरू ? | Operation Sindoor |Drone Attack,News18 Bihar Jharkhand,2025-05-13T01:40:56Z,84932,683,2,28
230,voQsj4gWCHw,Roasting Pakistani Instagram Reels on Operation Sindoor Ft. Hania Amir,Kdlife,2025-05-13T15:26:22Z,28399,2264,44,295
231,XqO6-K9KU_g,PM Narendra Modi's address to the nation | Operation Sindoor,Narendra Modi,2025-05-12T15:44:51Z,228300,24360,167,1175
232,rzUDfFSPaJk,"PM Modi, Operation Sindoor: পরমাণু যুদ্ধের আশঙ্কাতেই কি ট্রাম্পের 'শান্তির' বার্তা? | #TV9D",TV9 Bangla,2025-05-13T16:50:11Z,7487,82,0,3
233,VYy7X3vt8mw,PM Modi ने Operation Sindoor के बाद कहा- 'Pakistan के आतंकी-सैन्य ठिकानों पर अभी सिर्फ...',The Lallantop,2025-05-12T14:58:11Z,16934,232,5,28
234,xy9R3fhYn-k,"Operation Sindoor: Indian Army ने किया साफ, हमने Pakistan के किराना हिल्स पर हमला नहीं किया",Aaj Tak HD,2025-05-12T12:39:01Z,120827,1121,19,54
235,W2vkwd_qcXo,Pakistan Ceasefire Violation पर DGMO ने Operation Sindoor की तस्वीर दिखा पूरी कहानी बताई,The Lallantop,2025-05-12T09:39:53Z,250679,3337,30,209
236,5_gKIQgoNk8,"Operation Sindoor चालू है, Ceasefire हो या नहीं, इस पर बंटे लोग! Pakistan drones | Indian Army",The Lallantop,2025-05-12T08:00:05Z,34303,658,17,145
237,P5exxi7aL7o,Operation Sindoor: ऑपरेशन सिंदूर.. 3 आतंकी ढेर! | Breaking News | Jammu-Kashmir | Shopain,Zee News,2025-05-13T07:10:06Z,33009,439,5,30
238,T6Wu37k2ujY,முடியாத மோதல்: பாமக -வில் நடப்பது என்ன? | India Pakistan Operation Sindoor |Imperfect Show 12.5.2025,Vikatan TV,2025-05-12T13:30:21Z,51146,1161,17,125
239,r2P4bpTVLuc,Bhaiyaji Kahin With Prateek Trivedi : Operation Sindoor | Pak Army | PM Modi | Asim Munir | War,News18 India,2025-05-12T17:00:06Z,36999,493,1,90
240,aQsQ4kKJmxw,PM Narendra Modi Address To The Nation First Since Operation Sindoor | ZEE News,Zee Telugu News,2025-05-12T17:26:20Z,132569,960,10,0
241,OvYGIKDDsYs,Breaking News: India Pakistan के बीच DGMO की बातचीत खत्म | Operation Sindoor | Hindi News,TIMES NOW Navbharat,2025-05-12T12:46:25Z,15558,148,0,7
242,H2XDxAGtzD8,Operation Sindoor के दौरान सर्वोच्च बलिदान देने वाले Indian Army के इन वीर शहीदों को नमन,The Lallantop,2025-05-12T08:30:16Z,33212,806,11,134
243,Nvl1wndgdio,PM Modi LIVE: आज रात 8 बजे पीएम मोदी LIVE | Operation Sindoor | Indian Army,IndiaTV,2025-05-12T12:32:13Z,20155,155,1,1
244,17004pnp_cU,"Operation Sindoor: PM Modi Strikes Hard, Sends Clear Message to Pakistan!",Shubhankar Mishra ,2025-05-12T17:23:28Z,836796,38166,719,4183
245,RTskZSgjjCM,Operation Sindoor: आसिम मुनीर ने ही दिखाई भारत से पिटे पाक जवानों की हालत | Pakistan,Crime Tak,2025-05-13T07:00:32Z,10519,97,0,3
246,08tUDa6U0iw,தகர்க்கப்பட்ட Pakistan அணு ஆயுத கிடங்கு? | Dr. Niranjan Interview | Operation Sindoor | Indian Army,Chanakyaa,2025-05-13T10:04:55Z,47109,1487,11,120
247,-1_Gec6tEuk,Aar Paar With Amish Devgan : Operation Sindoor | PM Modi | India Pakistan War Tension | News18,News18 India,2025-05-12T17:55:56Z,33204,487,3,81
248,m2mU9Wl5GVo,"IND vs PAK LIVE Updates: భారత్, పాక్ చర్చలు ప్రత్యక్ష ప్రసారం | Operation Sindoor | Ntv",NTV Telugu,2025-05-12T14:39:48Z,416012,1433,26,0
249,GR3Rw4M0QQ8,Narendra Modi Addresses Nation on Operation Sindoor: Trump Claims Credit for Ceasefire Again | LIVE,The Public India,2025-05-12T16:43:17Z,460738,9633,260,1164
250,T6Wu37k2ujY,முடியாத மோதல்: பாமக -வில் நடப்பது என்ன? | India Pakistan Operation Sindoor |Imperfect Show 12.5.2025,Vikatan TV,2025-05-12T13:30:21Z,51146,1161,17,125
251,r2P4bpTVLuc,Bhaiyaji Kahin With Prateek Trivedi : Operation Sindoor | Pak Army | PM Modi | Asim Munir | War,News18 India,2025-05-12T17:00:06Z,37015,493,1,90
252,OvYGIKDDsYs,Breaking News: India Pakistan के बीच DGMO की बातचीत खत्म | Operation Sindoor | Hindi News,TIMES NOW Navbharat,2025-05-12T12:46:25Z,15558,148,0,7
253,H2XDxAGtzD8,Operation Sindoor के दौरान सर्वोच्च बलिदान देने वाले Indian Army के इन वीर शहीदों को नमन,The Lallantop,2025-05-12T08:30:16Z,33212,806,11,134
254,Nvl1wndgdio,PM Modi LIVE: आज रात 8 बजे पीएम मोदी LIVE | Operation Sindoor | Indian Army,IndiaTV,2025-05-12T12:32:13Z,20155,155,1,1
255,17004pnp_cU,"Operation Sindoor: PM Modi Strikes Hard, Sends Clear Message to Pakistan!",Shubhankar Mishra ,2025-05-12T17:23:28Z,836796,38166,719,4183
256,RTskZSgjjCM,Operation Sindoor: आसिम मुनीर ने ही दिखाई भारत से पिटे पाक जवानों की हालत | Pakistan,Crime Tak,2025-05-13T07:00:32Z,10519,97,0,3
257,08tUDa6U0iw,தகர்க்கப்பட்ட Pakistan அணு ஆயுத கிடங்கு? | Dr. Niranjan Interview | Operation Sindoor | Indian Army,Chanakyaa,2025-05-13T10:04:55Z,47109,1487,11,120
258,-1_Gec6tEuk,Aar Paar With Amish Devgan : Operation Sindoor | PM Modi | India Pakistan War Tension | News18,News18 India,2025-05-12T17:55:56Z,33204,487,3,81
259,m2mU9Wl5GVo,"IND vs PAK LIVE Updates: భారత్, పాక్ చర్చలు ప్రత్యక్ష ప్రసారం | Operation Sindoor | Ntv",NTV Telugu,2025-05-12T14:39:48Z,416012,1433,26,0
260,GR3Rw4M0QQ8,Narendra Modi Addresses Nation on Operation Sindoor: Trump Claims Credit for Ceasefire Again | LIVE,The Public India,2025-05-12T16:43:17Z,460738,9633,260,1164
261,kHQgrUTcCM8,"Vardat: Operation Sindoor में जैश का सबसे बड़ा कैंप तबाह, Masood Azhar के रिश्तेदार समेत कई आतंकी ढेर",Aaj Tak,2025-05-12T18:41:12Z,394545,2347,15,140
262,-AJ3kVD1PXo,"പഴുതില്ലാതെ പാകിസ്താനെ പൂട്ടിയത് ഇങ്ങനെ, പുതിയ വിവരങ്ങൾ | India Pak Tensions | Operation Sindoor",24 News,2025-05-12T08:50:23Z,196216,1711,14,226
263,q4km1rV1phQ,Live: ଭାରତ କରିବ ଯୁଦ୍ଧ ! | India Pakistan War News | Operation Sindoor 2 | Donald trump | Odia News,News18 Odia,2025-05-12T06:40:24Z,220500,1038,1,0
264,MFk6ymAzz60,देखिए AI की कल्पना से सेना की एक अकल्पनीय कार्रवाई Operation Sindoor | Sweta Singh |PM Modi | AajTak,Aaj Tak,2025-05-13T15:19:25Z,13831,227,5,15
265,6HJnAKz9qJs,"Operation Sindoor Shocks Pakistan! 11 Airbases Destroyed, India Exposes Lies with Proof! | TV9",TV9 Gujarati,2025-05-13T12:01:13Z,5621,0,0,1
266,St6Kwt4Twnk,Operation Sindoor LIVE: Pakistan Threatens War Over Indus Waters Treaty Suspension | Palki Sharma,Firstpost,2025-05-14T08:41:51Z,21489,187,0,4
267,8PbL8wK0KMc,🔴 LIVE || ପାକିସ୍ତାନର ପୁଣି ଆକ୍ରମଣ  || Operation Sindoor | Pakistan | Kanak News,Kanak News,2025-05-12T18:00:50Z,17516,152,4,2
268,lLokncK_NF0,Operation Sindoor: All Lies Exposed.,Open Letter,2025-05-12T11:01:23Z,244476,17431,307,2424
269,BL6rtvlPIwA,Operation Sindoor: India vs Pakistan | IAF Destroyed PAF’s Nurkhan Airbase | Brahmos | Akash | S-400,News Nation,2025-05-12T14:07:11Z,143130,1602,29,90
270,zw5tW25KB9Y,Pakistan ராணுவவத்தின் முதுகெலும்பை முறித்த  India | Operation Sindoor | Oneindia Tamil,Oneindia Tamil,2025-05-12T13:53:00Z,13356,224,2,10
271,ua2eAN2BGvY,"#LIVE : Operation Sindoor मोदी तडकाफडकी लाईव्ह,सर्वात मोठी घोषणा पाकिस्तानवर अणुबॉम्ब?  | Modi Live",VIRAL IN INDIA,2025-05-12T15:21:44Z,76086,571,2,60
272,hi4xIW4PT54,PM Modi Meets Soldiers at Adampur Airbase After Operation Sindoor,Zee Business,2025-05-13T07:37:19Z,160753,6893,22,147
273,QZ3Xk-bKefQ,No More Tolerance for Nuclear Blackmail – PM Modi's Powerful Address | Operation Sindoor,Zee Business,2025-05-13T02:37:21Z,36746,1415,19,47
274,2DLUPlOkU9g,ಪಾಕ್‌ಗೆ ಆಯುಧ ಕಳಿಸಿಲ್ಲ: ಚೀನಾ | Operation Sindoor | Pak Army Chief | Masth Magaa  Full News | Amar,Masth Magaa,2025-05-12T15:43:08Z,264083,10683,28,572
275,reuzUZsgTMU,Social Media Users Mock Pakistan After Operation Sindoor | Vantage with Palki Sharma | N18G,Firstpost,2025-05-12T18:40:00Z,332887,11970,102,1700
276,WUtJF-w3giw,Pakistan पर 8 बजे मौन तोड़ेंगे Modi | Operation Sindoor | India-Pakistan Ceasefire | BJP | #dblive,DB Live,2025-05-12T12:51:03Z,24086,400,6,27
277,-Iird7vu5Vk,Rtd. Major Gen. GD Bakshi fumes on Asim Munir; says “Operation Sindoor not over”,ANI News,2025-05-12T12:45:59Z,19458,372,23,392
278,nbu-plRB1bY,Operation Sindoor: पाकिस्तान को भारतीय सेना का ऐसा अल्टिमेटम || Ajit Anjum,Ajit Anjum,2025-05-12T10:45:50Z,431349,9665,111,751
279,sn8niTsAlLs,"PM Modi, Operation Sindoor: পাকিস্তানকে মিথ্যাবাদী প্রমাণ করলেন প্রধানমন্ত্রী নরেন্দ্র মোদী! | #TV9D",TV9 Bangla,2025-05-13T16:36:57Z,6694,116,4,11
280,hRY2QX0C7QM,🔴LIVE| അതീവ ജാഗ്രതയിൽ അതിർത്തി | India-Pakistan Ceasefire Updates | Operation Sindoor,News18 Kerala,2025-05-12T10:12:46Z,77337,282,6,11
281,rJ0ygjLm2qY,Operation Sindoor LIVE| BrahMos in Action: How India Used BrahMos Missiles Against Pakistan | N18G,Firstpost,2025-05-13T07:19:40Z,74857,579,13,19
282,0yFx_rNg__4,India Pakistan News: 'Operation Sindoor Not Over' Major Gen GD Bakshi Slams Pak Army And Asim Munir,DNAIndiaNews,2025-05-12T16:05:23Z,31771,408,7,202
283,3Wl7I4DJ0QI,"Don't call Pakistan, they are… | Operation Sindoor",Shubhankar Mishra ,2025-05-12T02:30:05Z,1002612,34671,536,4654
284,HlAAhyAGW8o,Operation Sindoor LIVE: How India Destroyed Pakistani Airbases | India-Pak Conflict | Palki Sharma,Firstpost,2025-05-14T04:39:14Z,19400,132,0,1
285,gqatc39Qfw8,Operation Sindoor LIVE: Pakistan Violates Ceasefire | India Pakistan Conflict | Vantage Recap | N18G,Firstpost,2025-05-12T03:41:57Z,551126,3269,121,20
286,uzSL5vc6cWk,PM Modi LIVE | Narendra Modi address to the Nation | Operation Sindoor - TV9,TV9 Telugu Live,2025-05-13T01:11:52Z,78016,631,10,3
287,31bd8N2GkhQ,ଯୁଦ୍ଧରୁ ଆସିଲା ବଡ଼ ଖବର | India Pakistan War | Operation Sindoor | DGMO Meeting | War Update,News18 Odia,2025-05-12T05:47:55Z,18942,183,0,5
288,Us4waYEkmAM,Operation ‘Sindoor’ के बाद PM Narendra Modi Nation से Address | India | Pakistan | Army | News 24,News 24,2025-05-12T15:23:36Z,36588,273,0,66
289,omK44gaSUNI,Live: ଯୁଦ୍ଧର ବଡ଼ ଅପଡେଟ୍ | India Pakistan War | Operation Sindoor | Pahalgam Attack | War Update,News18 Odia,2025-05-12T13:44:15Z,265306,1332,18,0
290,46-OknTAFas,#DBLiveBreaking : Ceasefire पर Modi की चुप्पी पर उठे सवाल ! Operation Sindoor | India Pakistan War |,DB Live,2025-05-12T07:41:45Z,106353,2271,8,92
291,DDrJz-v97Og,"'ये न्यू नॉर्मल..' Operation Sindoor, India Pakistan Ceasefire पर PM Modi ने हर बात बताई Duniyadari",The Lallantop,2025-05-12T15:29:34Z,73293,878,14,125
292,zjiG3lSzJ6g,"Operation Sindoor: पाक के खिलाफ नौसेना की तैयारी, मिग-29K तैनात, Indian Navy ने जारी किया वीडियो",Aaj Tak,2025-05-13T03:15:11Z,94657,733,9,39
293,O2W08f3djdE,Operation Sindoor: PM Modi Speech Today | India Pakistan Ceasefire |  Dr.Manish Kumar  | Capital TV,CAPITAL TV,2025-05-12T13:39:17Z,75840,4406,8,182
294,1QbgZ1u6bDQ,"Exclusive Analysis By Grandmaster Shifuji |Official Military Briefing Explained, Operation Sindoor.",GRANDMASTER SHIFUJI'S MISSION PRAHAR,2025-05-12T04:00:04Z,103818,7774,18,479
295,HTgM7dYivTM,Ajit Doval। Operation Sindoor। ‘অপারেশন সিদুঁর’-এর অন্যতম কারিগর। বৃদ্ধ হলেও ক্ষুরধার বুদ্ধি।,Anandabazar Patrika,2025-05-13T13:55:55Z,10062,209,4,22
296,JCEMXfL35vA,Operation Sindoor World Premiere LIVE: India Vs Pakistan Conflict | India Today AI Film Exclusive,India Today,2025-05-14T04:46:36Z,31812,137,0,9
297,HrdapOxuIZA,"Director announces ""Operation Sindoor"" Movie, says Sorry after getting Hate! 🙏  #shorts",Neon Man Shorts,2025-05-12T15:30:08Z,70891,4639,19,50
298,XqwKxPpHaHQ,పాక్ లో పేలిన అణుబాంబు..? | LIVE🔴India-Pakistan Nuclear War..? | Operation Sindoor | India Pak War |,Tolivelugu,2025-05-14T04:37:48Z,120345,412,5,2
299,ztUEbhStj6s,"Operation Sindoor | ISRO ची महत्वाची भूमिका, पाकिस्तानच्या हालचालींवर इस्त्रोच्या 10 उपग्रहांची नजर",TV9 Marathi,2025-05-12T06:11:50Z,10184,0,0,8
300,r-VYB8cd9Q8,LIVE: ପାକିସ୍ତାନରେ ପ୍ରଳୟ | India Pakistan War | Pahalgam Attack | Operation Sindoor | War News,News18 Odia,2025-05-12T02:04:32Z,125827,779,9,4
301,yrfycJ6LziU,🔴Operation Sindoor Updates Live | India-Pakistan Ceasefire Updates | India pakistan Tensions | N18G,News18 Kerala,2025-05-12T09:07:25Z,37911,107,3,2
302,IpMi0nhNiP0,PM Modi on Operation Sindoor LIVE: PM મોદીનું રાષ્ટ્રજોગ સંબોધન | TV9Gujarati,TV9 Gujarati,2025-05-12T14:55:26Z,20746,0,0,4
303,HfpKDOxYBSE,India vs Pakistan: पाकिस्तान ने Operation Sindoor में Rafale गिराया ? | India Pakistan Ceasefire,Oneindia Hindi | वनइंडिया हिंदी,2025-05-12T05:42:52Z,25408,155,0,32
304,fQElTmHQQoA,పేలిన అణు బాంబు.? India-Pakistan Nuclear War | Operation Sindoor | India Pak War@sumantvparenting,SumanTV Parenting,2025-05-13T05:49:50Z,55771,544,3,36
305,n-qnnGbrgjA,Pakistan BEGS For Ceasefire | Operation Sindoor Phase 3,The Sham Sharma Show,2025-05-12T12:20:36Z,614842,34759,281,1827
306,YJFcBdRhL4Y,PM Modi on Operation Sindoor LIVE: आधी रात होते ही आतंकवाद पर मोदी का कड़ा संदेश LIVE,Republic Bharat,2025-05-13T08:30:13Z,194046,1702,1,1
307,ocv7WSA6_Lo,Operation Sindoor: PM Narendra Modi ਦਾ ਸੰਬੋਧਨ LIVE,PTC NEWS,2025-05-12T16:16:01Z,207905,1463,24,9
308,3htQYEZeRpQ,"PM Modi Speech | Operation Sindoor |""அணு ஆயுத சோதனைக்கு எல்லாம் பயப்பட மாட்டோம்"" | India vs Pakistan",News18 Tamil Nadu,2025-05-12T15:03:51Z,24957,362,0,31
309,OB8pb6XuO4Y,Operation Sindoor : Birth of Pakistan : A tragedy | India-Pakistan War | Avadh Ojha Sir | Part - 2,Avadh Ojha,2025-05-12T16:37:20Z,19118,792,5,41
310,PEwIqm5NMHs,PM Modi Meet Air force Jawan: Adampur Air base पर Operation Sindoor के जवानों से मिले पीएम मोदी,Navbharat Times नवभारत टाइम्स,2025-05-13T07:53:46Z,7800,115,0,11
311,pAFDUoEebNg,"तेरी पाकिस्तान |Operation Sindoor का सच | 32 सेकंड में| Grandmaster Shifuji’s Quote,Poem on Pakistan",GRANDMASTER SHIFUJI'S MISSION PRAHAR,2025-05-12T10:36:44Z,101506,9163,0,294
312,uSPdAF_Sp7U,"India Pakistan Ceasefire LIVE: पाकिस्तान पर प्रहार, अगला मिशन तैयार! | Operation Sindoor",ABP NEWS,2025-05-12T12:36:05Z,28884,169,0,4
313,64csvbWM3_g,ഇന്ത്യയുടെ ആക്രമണം; ഞെട്ടി കറാച്ചിയും ഇസ്ലാമാബാദുമുൾപ്പടെയുള്ള പാക് നഗരങ്ങൾ |Operation Sindoor,asianetnews,2025-05-12T12:42:23Z,121012,954,4,93
314,_jkSB-CXUe4,Operation Sindoor  - உலக நாடுகளுக்கு உணர்த்தியது என்ன? மோதல் முடிந்தும் சர்ச்சைகள் தொடர்வது ஏன்?,Sun News,2025-05-12T16:02:46Z,30847,316,7,136
315,CNqIf7E5Bd4,"Indian Army ने दिए सबूत, Operation Sindoor में लश्कर और जैश के कई खूंखार आतंकी मारे गए.",India.com,2025-05-12T12:45:03Z,38736,244,4,23
316,XjCWEwonj7E,🔴LIVE: భారత్ జోలికొస్తే వదిలే ప్రసక్తే లేదు || Operation Sindoor || India Pakistan War Updates | ABN,ABN Telugu ,2025-05-12T12:20:34Z,13169,61,0,0
317,haeaVqSYD2g,"Operation Sindoor की तारीफ करते-करते मंत्री जी ने कर दी भारी भूल, अब माफी मांगते फिर रहे हैं ! MPTak",MP Tak,2025-05-13T12:37:28Z,10905,184,1,132
318,eY5yxq0dfk4,"India-Pakistan: 'Operation Sindoor जारी', Ceasefire पर बोले Retd. Lt Gen KJS Dhillon?| PM Modi|#tv9d",TV9 Bharatvarsh,2025-05-12T12:30:22Z,16721,173,1,26
319,XqwKxPpHaHQ,పాక్ లో పేలిన అణుబాంబు..? | LIVE🔴India-Pakistan Nuclear War..? | Operation Sindoor | India Pak War |,Tolivelugu,2025-05-14T04:37:48Z,120345,412,5,2
320,YiD0BvmFMdU,Indian Army Soldier Murali Naik | Operation Sindoor | Major Sps Oberoi | Venu Kalyan,Venu Kalyan Life & Business Coach,2025-05-12T14:45:29Z,290170,8128,5,221
321,JCEMXfL35vA,Operation Sindoor World Premiere LIVE: India Vs Pakistan Conflict | India Today AI Film Exclusive,India Today,2025-05-14T04:46:36Z,31812,137,0,9
